Status,Progress,Duration (in seconds),Finished,UserLanguage,Q9,Apt advice,Apt expectancy,Effort Advice,Effort Expectancy,Strat Advise,Strat Expectancy,Luck Advise,Luck Expectancy,Apt Out,Apt Var,Apt Uncon,Effort Out,Effort Var,Effort Uncon,Mood Out,Mood Var,Mood Uncon,Strat Out,Strat Var,Strat Uncon,Luck Out,Luck Var,Luck Uncon,Task Out,Task Var,Task Uncon,SMS1,SMS2,SMS3,SMS4,SMS5,SMS6,SMO1,SMO2,SMO3,MP1,MP2,MP3,MP4,SO1,SO2,SO3,SO4,Gender,Race,Race_4_TEXT,Age,Education,FL_25_DO,FL_26_DO,MonitoringPerformance_DO,SO_DO
0,100,565,1,EN,1,,,,,,,"First get a lot of rest the night before, eat moderately in the morning.  I find meditation a half hour before taking tests calms my nerves.  And sometimes right before tests.  If you get frazzled during the test take deep breaths.  ",10,5,7,5,1,7,1,1,6,1,2,7,1,6,6,7,4,7,1,4,4,4,2,3,4,6,5,5,3,3,5,2,4,5,4,5,2,1,,55,4,LuckScenario_Other,LuckDimensions|StrategyDimensions|TaskDimensions|MoodDimensions|EffortDimensions|AptitudeDimensions,Q80|MP3|MP4|MP1|MP2,Q90|SO2|SO3|SO1|SO4
0,100,371,1,EN,1,,,,,,,Make sure you don't eat anything unusual the day of and the day before the test. Also study hard as usual and you should do well.,9,2,4,4,2,4,2,2,6,3,2,5,2,7,7,7,6,6,6,4,4,4,2,4,4,6,6,5,5,4,4,4,3,3,3,3,2,1,,23,5,LuckScenario_Other,MoodDimensions|EffortDimensions|LuckDimensions|StrategyDimensions|TaskDimensions|AptitudeDimensions,Q80|MP4|MP2|MP3|MP1,Q90|SO1|SO3|SO2|SO4
0,100,611,1,EN,1,I would ask her to study with me and that I will help her on the topics so as she has a better understanding as well as get more information and study time in.,9,,,,,,,2,5,1,3,5,1,1,5,1,4,4,1,7,4,7,4,6,3,4,3,5,2,4,4,4,3,5,4,5,4,3,3,5,3,4,2,1,,34,4,AptitudeScenario_Other,EffortDimensions|AptitudeDimensions|TaskDimensions|MoodDimensions|StrategyDimensions|LuckDimensions,Q80|MP2|MP1|MP3|MP4,Q90|SO1|SO2|SO3|SO4
0,100,601,1,EN,1,,,I would first let her know that studying is very important and paying attention class would help alot. I would then ask if she has concentration issues and ask what her diet is. I would also like to know if she has been exercising. After taking these steps I would have her let me know if her concentration gets better.,9,,,,,4,2,3,4,2,3,2,5,2,3,2,6,4,6,2,5,2,3,4,2,3,1,2,4,3,2,5,2,4,3,3,3,3,2,3,1,1,,23,3,EffortScenario_Other,LuckDimensions|AptitudeDimensions|MoodDimensions|TaskDimensions|EffortDimensions|StrategyDimensions,Q80|MP4|MP2|MP3|MP1,Q90|SO3|SO4|SO2|SO1
0,100,350,1,EN,1,,,"I would advise her to write note cards.  I would tell her to look over her notes and go over chapters or materials from class.  Write out the note cards, then study them.  ",11,,,,,5,7,1,1,5,2,2,7,3,2,5,2,7,7,7,5,7,5,4,3,4,3,5,4,4,4,3,4,5,4,3,4,5,4,4,2,1,,35,5,EffortScenario_Other,AptitudeDimensions|EffortDimensions|LuckDimensions|StrategyDimensions|TaskDimensions|MoodDimensions,Q80|MP3|MP4|MP2|MP1,Q90|SO1|SO2|SO3|SO4
0,100,86,1,EN,1,,,,,,,TO BE CONFIDENT IN HER SELF AND NOT WORRY ABOUT IT ,11,7,7,2,7,6,7,7,7,3,6,7,4,7,6,3,7,6,3,3,3,3,2,1,3,2,1,2,3,4,2,2,4,4,2,3,1,1,,23,3,LuckScenario_Other,EffortDimensions|AptitudeDimensions|StrategyDimensions|MoodDimensions|TaskDimensions|LuckDimensions,Q80|MP1|MP3|MP2|MP4,Q90|SO3|SO2|SO4|SO1
0,100,240,1,EN,1,I'd tell her to study more. I'd tell her to make an outline of the important topics that will be tested on and to break them down into subgroups and try to understand the material rather than just memorize things. I'd be positive and supportive but also let her know nicely that this area of study might not suit her. ,4,,,,,,,6,5,6,2,5,1,1,7,2,6,5,2,7,7,7,7,7,4,3,4,3,2,3,4,5,3,2,5,4,4,2,3,4,3,4,1,1,,44,5,AptitudeScenario_Other,AptitudeDimensions|LuckDimensions|StrategyDimensions|MoodDimensions|EffortDimensions|TaskDimensions,Q80|MP2|MP3|MP1|MP4,Q90|SO2|SO3|SO1|SO4
0,100,382,1,EN,1,,,,,"If you’re asked that question in a job interview, the bottom line is that you have to walk the fine line between confidence and arrogance. You have to come up with something to get the advantage and you only have one chance to put your best traits forward",10,,,6,7,6,5,6,5,6,7,6,6,6,6,4,3,2,3,6,5,3,2,3,5,4,3,7,6,7,3,3,5,4,4,5,5,4,1,1,,47,6,StrategyScenario_Other,MoodDimensions|AptitudeDimensions|StrategyDimensions|TaskDimensions|EffortDimensions|LuckDimensions,Q80|MP4|MP2|MP3|MP1,Q90|SO2|SO1|SO3|SO4
0,100,654,1,EN,1,,,,,,,I would advise her to sleep well. eat a light meal before the exam and meditate as well. It may calm her nerves for the test. ,6,2,2,2,1,5,1,1,6,4,4,4,4,4,4,4,6,6,6,4,4,4,2,4,4,6,6,6,3,3,4,3,4,3,4,4,2,1,,32,5,LuckScenario_Other,AptitudeDimensions|StrategyDimensions|TaskDimensions|EffortDimensions|MoodDimensions|LuckDimensions,Q80|MP2|MP4|MP1|MP3,Q90|SO2|SO3|SO1|SO4
0,100,685,1,EN,1,"I would advise Amelia to take some time to reconfigure her strategy. Every person has at least one topic which they are not good at, and in order to do well the study method must be changed accordingly. If she struggles to understand the materials I would say it might be best to first approach the teacher/professor and ask if they have time to help or extra materials or suggestions to better learn the material. Then I would start at the very beginning of the materials relevant to the test and try to approach it as if you were teaching to another person. Putting aside your embarrassment and asking a friend or parent to be your 'student' will help you to understand the material more deeply. If you can explain the material to someone who has not taken the class and does not know the topic, then you can say you know the material well enough.",9,,,,,,,3,2,3,3,7,1,1,4,2,2,7,1,6,7,5,5,3,4,5,4,4,2,5,5,6,7,5,4,4,5,3,5,4,4,4,1,1,,26,5,AptitudeScenario_Other,EffortDimensions|MoodDimensions|AptitudeDimensions|StrategyDimensions|LuckDimensions|TaskDimensions,Q80|MP1|MP4|MP3|MP2,Q90|SO1|SO4|SO3|SO2
0,100,552,1,EN,1,,,,,I would tell her to take minimal notes but take the notes that she will remember the most.  I wouldn't stick with just the books but would do my own online research from the notes I took.  ,9,,,1,4,2,1,4,3,3,7,4,1,6,2,6,6,6,6,5,4,3,3,3,2,2,3,5,4,4,3,4,2,2,2,3,3,3,2,1,,42,3,StrategyScenario_Other,LuckDimensions|StrategyDimensions|MoodDimensions|EffortDimensions|AptitudeDimensions|TaskDimensions,Q80|MP2|MP4|MP3|MP1,Q90|SO1|SO4|SO3|SO2
0,100,246,1,EN,1,,,"I would let her know that it might help to be a bit more present during class, and make sure she is adding to her study materials with the things we are covering in class. I'd offer to meet up with her after class and help her arrange the things we'd covered that day in a way that makes it easy to study, and hopefully my enthusiasm and a social connection would encourage her to try a bit harder.",9,,,,,4,7,1,2,7,1,1,7,4,4,7,1,4,7,7,7,2,6,3,1,5,3,5,4,6,5,5,4,1,3,2,3,3,3,3,2,1,,26,4,EffortScenario_Other,StrategyDimensions|MoodDimensions|AptitudeDimensions|LuckDimensions|EffortDimensions|TaskDimensions,Q80|MP2|MP1|MP4|MP3,Q90|SO2|SO4|SO1|SO3
0,100,541,1,EN,1,,,,,,,She was not well and she would not the exam.,7,5,4,5,5,4,6,5,4,5,5,4,5,5,4,5,5,4,5,2,3,4,2,3,2,6,4,5,2,3,3,2,3,4,3,4,2,1,,49,5,LuckScenario_Other,TaskDimensions|StrategyDimensions|MoodDimensions|EffortDimensions|AptitudeDimensions|LuckDimensions,Q80|MP1|MP2|MP4|MP3,Q90|SO4|SO1|SO2|SO3
0,100,719,1,EN,1,,,,,,,"I would ask her about the source of the stomachache and advise her to go to the school health services she thought they might be able to help her control her stomach issues. If she had an illness or some sort of psychological issue, I would advise her to have health services help her approach the teacher and get some sort of accommodation should this be likely to happen again. Beyond that, I would offer to help her prepare for the next test so that we could make sure she was rested, relaxed, and ready.",8,2,3,4,2,4,2,1,6,5,1,4,2,7,7,1,7,6,4,4,5,4,3,4,4,6,6,5,4,4,3,3,3,4,3,3,1,1,,42,6,LuckScenario_Other,LuckDimensions|EffortDimensions|StrategyDimensions|TaskDimensions|MoodDimensions|AptitudeDimensions,Q80|MP4|MP2|MP3|MP1,Q90|SO4|SO3|SO2|SO1
0,100,668,1,EN,1,,,Read all of the material that the test will be based on at least three times. Write down anything that is unclear to you after doing the reading. Make an appointment with the professor and go over the things that you don't understand with them. Ask them for suggestions on how to understand their topic better. Go to the library and see if there is a study group for this course that you could join. Ask the librarian for tips on how to take good notes in class. There are probably a few books on that that you could check-out. All of this should improve your grade.,10,,,,,2,5,5,1,6,1,1,7,1,4,6,2,7,7,7,5,5,4,5,5,4,2,5,4,6,6,6,3,4,4,5,3,4,3,3,2,1,,66,6,EffortScenario_Other,AptitudeDimensions|EffortDimensions|MoodDimensions|StrategyDimensions|LuckDimensions|TaskDimensions,Q80|MP2|MP3|MP1|MP4,Q90|SO2|SO1|SO4|SO3
0,100,250,1,EN,1,,,,,I could help you study if you need some help. I think that trying to memorize everything the teacher is saying isn't really helping you. I can help you find some other way that can get you to learn the material and ace the tests.,9,,,1,5,3,1,5,1,1,7,2,3,7,1,6,6,7,7,5,2,5,5,4,2,4,5,4,5,5,4,5,4,3,4,5,3,4,2,1,,33,5,StrategyScenario_Other,TaskDimensions|LuckDimensions|AptitudeDimensions|MoodDimensions|EffortDimensions|StrategyDimensions,Q80|MP1|MP4|MP3|MP2,Q90|SO4|SO2|SO1|SO3
0,100,223,1,EN,1,,,"You need to put more time into studying and your study materials.  I suggest going back over the topics or chapters to be covered and making detailed notes, then study from those notes.  Give yourself a couple of hours a night if you can.",6,,,,,1,4,4,1,7,1,1,7,4,1,4,4,7,7,7,7,7,7,3,3,3,3,4,4,2,2,4,4,3,4,2,3,3,2,3,2,1,,36,5,EffortScenario_Other,LuckDimensions|EffortDimensions|MoodDimensions|TaskDimensions|StrategyDimensions|AptitudeDimensions,Q80|MP2|MP4|MP1|MP3,Q90|SO3|SO4|SO2|SO1
0,100,143,1,EN,1,I would tell her to get a tutor that can work with her one on one and help her understand the material better. ,2,,,,,,,1,2,6,1,7,1,1,7,7,1,7,1,7,7,7,7,7,7,3,3,3,3,3,3,1,1,1,3,4,4,2,4,5,4,4,2,1,,29,5,AptitudeScenario_Other,MoodDimensions|EffortDimensions|StrategyDimensions|AptitudeDimensions|TaskDimensions|LuckDimensions,Q80|MP4|MP1|MP2|MP3,Q90|SO2|SO3|SO4|SO1
0,100,426,1,EN,1,I would ask how she goes about preparing for the test and look to see how well she takes notes.  I would try to target the specific areas of the subject which she is having the most difficulty.  I would try to break the subject matter down further or explain in greater detail to help her better understand the material. I would also recommend that she review different materials presented in different manners or perspectives which may aid in her comprehension.,6,,,,,,,1,5,1,1,7,1,4,7,3,1,7,1,7,7,7,3,7,1,3,3,4,3,5,2,5,5,6,2,4,4,1,3,4,4,4,1,1,,46,5,AptitudeScenario_Other,MoodDimensions|StrategyDimensions|LuckDimensions|AptitudeDimensions|TaskDimensions|EffortDimensions,Q80|MP1|MP4|MP2|MP3,Q90|SO3|SO1|SO2|SO4
0,100,503,1,EN,1,,,You should study a lot. You have to really pay more attention in class. You have to put in the effort. If you want to do well it is hard but you can do it.,9,,,,,2,2,6,1,2,2,1,6,4,2,4,6,6,5,6,6,5,5,3,2,3,2,3,2,2,3,4,3,3,3,2,2,3,3,2,2,1,,44,4,EffortScenario_Other,MoodDimensions|AptitudeDimensions|TaskDimensions|StrategyDimensions|LuckDimensions|EffortDimensions,Q80|MP2|MP1|MP4|MP3,Q90|SO1|SO4|SO2|SO3
0,100,311,1,EN,1,,,,,,,"You should study a lot for the test. Make sure you are eating healthy, taking your vitamins, and washing your hands to avoid illness. Get a good night's sleep before the test. Stay hydrated, but don't drink a lot of liquid in the couple hours before the test, so that you won't have to get up to use the restroom. Try again and I'm sure you'll do great.",10,2,3,2,1,4,2,1,6,4,3,4,2,7,6,7,6,5,6,3,3,4,2,3,3,4,3,2,3,3,3,2,3,4,3,4,1,1,,31,5,LuckScenario_Other,EffortDimensions|MoodDimensions|StrategyDimensions|TaskDimensions|AptitudeDimensions|LuckDimensions,Q80|MP3|MP1|MP2|MP4,Q90|SO4|SO1|SO3|SO2
0,100,736,1,EN,1,"I would advice amelia to study the previous study materials in detail. i would suggest her to try some of the methods i use for myself suc as learning in small chunks, memorizing the most important parts of the study such as dates, names, events (how and why and where they happened), who was involved and so on. if she has been having trouble understanding the overall material, then this would be the perfect method to try, and most importantly she must not memorize everything in one day, she needs to divide the study into several parts. this way she will enoug time to revise the previous old memorization which will make sure that whatever she studied and memorized will stay in her memory for extended period of time. ",9,,,,,,,3,4,1,2,5,3,4,3,1,1,4,2,4,5,4,5,6,2,5,4,4,1,4,5,6,5,4,4,5,5,5,4,4,5,4,2,5,,28,5,AptitudeScenario_Other,TaskDimensions|MoodDimensions|EffortDimensions|StrategyDimensions|LuckDimensions|AptitudeDimensions,Q80|MP4|MP1|MP3|MP2,Q90|SO4|SO3|SO2|SO1
0,100,765,1,EN,1,"Missing values are considered to be the first obstacle in predictive modeling. Hence, it’s important to master the methods to overcome them. Though, some machine learning algorithms claim to treat them intrinsically, but who knows how good it happens inside the ‘black box’.  ",10,,,,,,,6,6,7,7,6,5,6,7,6,5,6,5,7,5,6,7,6,5,4,5,3,4,5,3,7,6,5,5,4,4,4,4,3,5,4,1,7,,33,6,AptitudeScenario_Other,EffortDimensions|MoodDimensions|AptitudeDimensions|LuckDimensions|TaskDimensions|StrategyDimensions,Q80|MP1|MP4|MP2|MP3,Q90|SO1|SO4|SO2|SO3
0,100,807,1,EN,1,,,,,"I would say to organize her study space and good planning, discuss with friends engaging in group studies, and explaining answers to each other. ",10,,,6,6,5,5,4,5,5,6,6,5,5,6,3,5,5,4,5,5,5,4,5,2,3,4,6,5,6,4,4,3,4,4,5,5,4,1,1,,30,5,StrategyScenario_Other,MoodDimensions|LuckDimensions|TaskDimensions|EffortDimensions|StrategyDimensions|AptitudeDimensions,Q80|MP2|MP4|MP1|MP3,Q90|SO2|SO4|SO1|SO3
0,100,370,1,EN,1,I would tell her to make flashcards to help her solidify concepts and definitions in her memory. I would explain to her that memorization is not too difficult as long as she commits to it every day for a half hour. ,11,,,,,,,1,7,1,1,7,1,1,7,1,1,7,1,4,4,4,1,7,1,5,1,1,1,5,1,7,7,7,3,5,3,3,5,5,5,5,1,1,,32,4,AptitudeScenario_Other,MoodDimensions|EffortDimensions|LuckDimensions|StrategyDimensions|AptitudeDimensions|TaskDimensions,Q80|MP4|MP2|MP3|MP1,Q90|SO1|SO2|SO4|SO3
0,100,196,1,EN,1,,,you need to work harder. you're smart and can do well you just have to pay better attention and take it seriously and i know that you can do well.,10,,,,,2,3,3,2,4,3,2,5,3,4,4,4,6,5,6,5,5,4,3,3,3,3,3,3,5,5,4,3,4,4,3,4,4,4,4,1,1,,31,3,EffortScenario_Other,AptitudeDimensions|TaskDimensions|LuckDimensions|EffortDimensions|MoodDimensions|StrategyDimensions,Q80|MP1|MP3|MP2|MP4,Q90|SO1|SO4|SO2|SO3
0,100,369,1,EN,1,,,,,I would advise Amelia to create flash cards with the information that she copied and to quiz herself using the flash cards. I would also advise her to create her own practice tests with the information she copied and take several practice tests and grade herself so she can identify where she is getting things wrong.,8,,,1,5,2,1,7,1,1,7,1,1,7,1,7,7,7,4,7,4,4,5,4,2,4,4,5,5,4,5,5,4,4,5,3,5,5,1,1,,36,4,StrategyScenario_Other,MoodDimensions|AptitudeDimensions|LuckDimensions|EffortDimensions|TaskDimensions|StrategyDimensions,Q80|MP2|MP4|MP3|MP1,Q90|SO1|SO3|SO2|SO4
0,100,541,1,EN,1,,,,,"I am not the best at taking tests either, but I would advise you do not try to memorize everything and just try to remember the important stuff. Also if there is a study guide try using that.",7,,,4,6,4,1,7,1,3,7,4,4,5,2,3,4,7,4,5,3,4,5,4,2,4,4,5,5,5,5,5,3,3,3,3,4,4,1,1,,33,5,StrategyScenario_Other,StrategyDimensions|MoodDimensions|AptitudeDimensions|EffortDimensions|TaskDimensions|LuckDimensions,Q80|MP3|MP2|MP4|MP1,Q90|SO3|SO2|SO4|SO1
0,100,325,1,EN,1,,,"I would tell Amelia she needs to pay attention during class. Also, I would tell her that she study at home for at least half an hour so she can do well on the next test. I'd even offer to help Amelia study during my free time.",11,,,,,5,5,6,1,2,2,1,5,3,3,4,2,4,4,3,4,6,6,4,4,5,2,4,5,5,6,5,3,3,4,3,3,4,3,3,1,2,,28,3,EffortScenario_Other,LuckDimensions|AptitudeDimensions|TaskDimensions|EffortDimensions|MoodDimensions|StrategyDimensions,Q80|MP2|MP1|MP3|MP4,Q90|SO4|SO2|SO3|SO1
0,100,291,1,EN,1,,,,,,,"Go somewhere quiet and breathe. In for 7, out for 7. In through your nose, out through your mouth. Think about how good it will feel to defeat the test, not about what may happen during. Breathe for about ten minutes before the test. Tell yourself that no matter what happens, everything will work out. ",7,1,6,2,1,6,2,1,7,3,1,6,2,6,7,3,7,1,4,2,2,2,4,3,4,4,2,1,4,2,2,3,3,4,4,3,2,1,,34,5,LuckScenario_Other,LuckDimensions|EffortDimensions|TaskDimensions|AptitudeDimensions|StrategyDimensions|MoodDimensions,Q80|MP3|MP4|MP1|MP2,Q90|SO1|SO4|SO2|SO3
0,100,555,1,EN,1,I would join a study group. I'd review the notes and rewrite the chapter that was discussed. I'd ask if the lesson could be recorded so I could listen to it again.,8,,,,,,,2,3,5,3,2,5,2,7,6,2,3,6,7,5,7,3,3,4,3,3,3,5,3,4,2,3,2,3,2,3,3,2,2,3,2,2,"1,5",,34,4,AptitudeScenario_Other,MoodDimensions|AptitudeDimensions|EffortDimensions|StrategyDimensions|TaskDimensions|LuckDimensions,Q80|MP3|MP2|MP1|MP4,Q90|SO1|SO3|SO4|SO2
0,100,533,1,EN,1,,,,,I would recommend taking notes how she usually does. Then she should take those notes and re-write them and arrange them in a way that she finds easier to learn. Possibly try to make a story out of it in a way by giving it a flow that helps her remember everything easier. ,7,,,1,1,2,1,5,1,1,7,4,1,5,2,5,6,7,7,7,6,3,4,4,2,5,5,5,5,6,4,4,3,3,3,4,4,3,1,1,,36,3,StrategyScenario_Other,StrategyDimensions|EffortDimensions|AptitudeDimensions|TaskDimensions|LuckDimensions|MoodDimensions,Q80|MP2|MP1|MP4|MP3,Q90|SO3|SO2|SO4|SO1
0,100,541,1,EN,1,,,"I would tell Amelia that she need to review all her notes and update them accordingly.  She also needs to make it a point to pay special attention to her class and possibly approach her instructor for additional clarification on subject matter that she is not understanding.  Overall, her efforts need to be ramped up to the highest possible degree.",11,,,,,1,4,4,1,7,1,1,7,2,2,6,2,6,7,7,6,7,5,5,5,5,2,5,5,7,7,7,5,5,5,5,5,5,5,5,1,1,,34,6,EffortScenario_Other,EffortDimensions|TaskDimensions|LuckDimensions|MoodDimensions|AptitudeDimensions|StrategyDimensions,Q80|MP1|MP4|MP3|MP2,Q90|SO4|SO1|SO2|SO3
0,100,254,1,EN,1,,,,,"You need to use better study strategies, dont try to memorize everything just find key components to study.",10,,,1,2,3,1,4,2,1,7,1,1,4,2,6,4,6,7,7,7,5,5,5,2,5,5,7,7,7,4,5,4,4,4,4,4,4,1,1,,38,4,StrategyScenario_Other,TaskDimensions|EffortDimensions|StrategyDimensions|LuckDimensions|AptitudeDimensions|MoodDimensions,Q80|MP1|MP3|MP2|MP4,Q90|SO3|SO2|SO4|SO1
0,100,613,1,EN,1,,,"i would urge amelia to review the relevant class materials, and to take better notes in class. if possible, i would advise amelia to talk with the instructor about preparations, and i would also offer to share my notes.",8,,,,,2,3,4,2,7,1,2,7,2,3,5,1,7,7,6,7,1,7,3,4,3,4,3,3,4,4,6,3,4,3,3,3,2,3,3,1,1,,41,4,EffortScenario_Other,AptitudeDimensions|EffortDimensions|LuckDimensions|MoodDimensions|TaskDimensions|StrategyDimensions,Q80|MP1|MP3|MP2|MP4,Q90|SO2|SO3|SO4|SO1
0,100,830,1,EN,1,,,"I would think about the most effective strategy for her specific situation, as opposed to what would work for me, and would advise her based on that. Given the limited information above, it sounds like Amelia might have trouble staying focused on class materials for a long stretch of time. As such, I'd advise that she study things in short bursts, even as short as 5 or 10 minutes, with breaks in between. After that phase of studying, I would recommend she answer practice test questions to identify which areas are giving her the most trouble, and then continue doing short study rounds on those topics. I would emphasize breaks and relaxing between bouts of studying, because it might make the prospect of putting in a lot of time and effort less stressful for someone who has not done it previously.",6,,,,,1,2,6,1,7,1,1,7,4,1,6,1,7,7,7,7,1,1,2,2,3,3,3,2,6,3,3,5,5,3,1,5,5,5,5,2,1,,30,5,EffortScenario_Other,LuckDimensions|AptitudeDimensions|TaskDimensions|EffortDimensions|StrategyDimensions|MoodDimensions,Q80|MP4|MP1|MP2|MP3,Q90|SO4|SO2|SO1|SO3
0,100,841,1,EN,1,,,,,To listen intently to what the teacher is saying and then study the books for further insight and clues.,11,,,1,6,1,1,7,1,1,7,1,1,7,1,7,7,7,6,7,7,5,5,5,1,5,5,7,7,7,5,5,5,5,5,5,5,5,1,1,,38,5,StrategyScenario_Other,AptitudeDimensions|TaskDimensions|StrategyDimensions|MoodDimensions|LuckDimensions|EffortDimensions,Q80|MP2|MP3|MP1|MP4,Q90|SO2|SO1|SO3|SO4
0,100,303,1,EN,1,"I guess I would try to ask her how she studied for the last test and what she felt worked and what she felt did not work. I would tell her about my study routine, and ask her if she feels like my routine might work for her. I would then try to give her other study methods that I think might work, and try to create a sort of personalized study routine for her, and give her tips on taking tests in general, and maybe some advice on where to get more information or lectures about the subject online.",10,,,,,,,1,2,7,1,7,4,4,7,4,1,7,2,7,4,7,7,7,6,3,3,3,3,2,3,3,3,2,5,5,5,4,3,3,3,3,1,1,,23,5,AptitudeScenario_Other,LuckDimensions|StrategyDimensions|EffortDimensions|AptitudeDimensions|TaskDimensions|MoodDimensions,Q80|MP2|MP1|MP4|MP3,Q90|SO4|SO1|SO2|SO3
0,100,745,1,EN,1,,,I would advise them to practice more and spend more time on learning the materials. She should pick up the slack and I would explain that to her directly that her grades are a direct result of her efforts.,10,,,,,1,2,6,2,4,3,1,6,4,3,4,2,7,7,7,4,5,3,4,3,3,2,3,3,5,5,5,3,4,3,3,4,4,4,4,1,1,,38,5,EffortScenario_Other,AptitudeDimensions|TaskDimensions|MoodDimensions|LuckDimensions|EffortDimensions|StrategyDimensions,Q80|MP1|MP3|MP2|MP4,Q90|SO4|SO2|SO1|SO3
0,100,664,1,EN,1,,,,,,,"Amelia should prepare for the test the same way she has always prepared for test in terms of studying.  The day before the test, she should make sure not to eat any foods that may upset her stomach and have an OTC stomach aid ready in case she feels ill again.",10,1,2,4,1,6,1,1,7,3,2,5,1,7,7,6,5,7,6,4,4,5,2,5,5,4,2,2,3,3,3,2,3,3,3,4,1,1,,37,5,LuckScenario_Other,LuckDimensions|EffortDimensions|AptitudeDimensions|StrategyDimensions|MoodDimensions|TaskDimensions,Q80|MP1|MP4|MP3|MP2,Q90|SO1|SO4|SO2|SO3
0,100,299,1,EN,1,,,"I would advise her to pay attention during class and take notes. Go over the materials each night so they're easier to remember. Before the test, read over the materials and notes one last time, paying special attention to the areas you've had trouble with.",9,,,,,1,3,3,1,5,3,1,7,4,2,5,2,7,7,7,7,5,4,3,3,4,2,3,3,5,6,6,4,4,3,2,3,4,3,3,2,1,,39,5,EffortScenario_Other,TaskDimensions|LuckDimensions|StrategyDimensions|EffortDimensions|AptitudeDimensions|MoodDimensions,Q80|MP3|MP4|MP2|MP1,Q90|SO3|SO4|SO1|SO2
0,100,826,1,EN,1,,,,,"I would advise her to get a group together to go over the information together. I believe that working with others is probably the best method of learning difficult material, as each person in the group brings something that the others lack to the table. If she couldn't find a group to study with, then instead I'd advise her to try a different way of tackling the subject matter. First break down the material into different parts to make it easier for her. Next, go over each part until you understand what the information means. She shouldn't just try to remember information, she should try to understand the meaning behind it. It'll be easier if she breaks it into smaller parts as the material won't seem overwhelming.",7,,,2,5,2,1,7,1,4,7,4,2,6,3,5,7,7,4,2,2,3,3,3,3,3,4,5,5,4,4,3,3,2,4,4,4,4,1,7,,33,4,StrategyScenario_Other,TaskDimensions|AptitudeDimensions|EffortDimensions|MoodDimensions|LuckDimensions|StrategyDimensions,Q80|MP2|MP4|MP1|MP3,Q90|SO1|SO4|SO3|SO2
0,100,843,1,EN,1,,,,,"You have to focus on the essence of your study material. Without grasping the ideas which are behind those words you write down and memorize, the entire process of attending classes becomes frivolous. ",9,,,4,5,3,3,7,1,4,7,3,5,6,1,4,7,4,7,2,6,4,4,4,2,4,4,6,6,6,5,5,4,5,4,4,4,4,1,1,,23,5,StrategyScenario_Other,StrategyDimensions|EffortDimensions|AptitudeDimensions|MoodDimensions|LuckDimensions|TaskDimensions,Q80|MP3|MP1|MP4|MP2,Q90|SO1|SO3|SO4|SO2
0,100,671,1,EN,1,,,,,"Please keep in mind that this isn't a criticism, only an observation: rote memorization does not work. I noticed that you furiously take notes in class and try to cram as much material as possible before exams, but this isn't the right way to apply knowledge. You end up regurgitating what you're told without fully understanding the reasoning behind it. Instead of trying to memorize material, try applying it. Once you understand the underlying principle behind what you're being taught, you'll be better able to use it, leading to better results on tests. You already know the professor won't be repeating the same lecture materials on test, so try to actually use what you're being taught instead of just memorizing it.",7,,,2,4,2,1,7,1,4,7,3,4,7,1,7,7,7,6,7,5,4,3,4,2,4,4,5,4,4,4,4,3,2,2,4,3,2,1,5,,32,5,StrategyScenario_Other,EffortDimensions|AptitudeDimensions|TaskDimensions|LuckDimensions|MoodDimensions|StrategyDimensions,Q80|MP3|MP4|MP1|MP2,Q90|SO3|SO1|SO2|SO4
